{
  "$schema": "https://json-schema.org/draft/2020-12/schema",
  "$id": "https://github.com/michaelchristianhaley/badass/schemas/compliance-matrix.schema.json",
  "title": "BADASS compliance evidence matrix",
  "type": "object",
  "required": [
    "$schema",
    "schema_version",
    "scope",
    "updated",
    "allowed_statuses",
    "rows"
  ],
  "additionalProperties": false,
  "properties": {
    "$schema": {
      "type": "string",
      "const": "../schemas/compliance-matrix.schema.json"
    },
    "schema_version": {
      "type": "integer",
      "const": 1
    },
    "scope": {
      "type": "string",
      "minLength": 1
    },
    "updated": {
      "type": "string",
      "pattern": "\\d{4}-\\d{2}-\\d{2}"
    },
    "allowed_statuses": {
      "type": "array",
      "minItems": 4,
      "uniqueItems": true,
      "items": {
        "type": "string",
        "enum": ["PASS", "FAIL", "ASK_USER", "NOT_APPLICABLE"]
      }
    },
    "rows": {
      "type": "array",
      "minItems": 1,
      "items": {
        "type": "object",
        "required": [
          "section",
          "status",
          "claim",
          "evidence",
          "question",
          "remediation",
          "rationale"
        ],
        "additionalProperties": false,
        "properties": {
          "section": {"type": "string", "minLength": 1},
          "status": {
            "type": "string",
            "enum": ["PASS", "FAIL", "ASK_USER", "NOT_APPLICABLE"]
          },
          "claim": {"type": "string", "minLength": 1},
          "evidence": {
            "type": "array",
            "uniqueItems": true,
            "items": {"type": "string", "minLength": 1}
          },
          "question": {"type": ["string", "null"]},
          "remediation": {"type": ["string", "null"]},
          "rationale": {"type": ["string", "null"]}
        }
      }
    }
  }
}
